<?xml version="1.0" encoding="UTF-8"?>
<?xml-stylesheet type="text/xsl" href="employee.xsl"?>

<!-- Internal DTD -->
<!DOCTYPE employees [
    <!ELEMENT employees (employee+)>
    <!ELEMENT employee (id, name, department, salary)>
    <!ELEMENT id (#PCDATA)>
    <!ELEMENT name (#PCDATA)>
    <!ELEMENT department (#PCDATA)>
    <!ELEMENT salary (#PCDATA)>
]>

<employees>
    <employee>
        <id>101</id>
        <name>John Doe</name>
        <department>HR</department>
        <salary>50000</salary>
    </employee>
    <employee>
        <id>102</id>
        <name>Jane Smith</name>
        <department>IT</department>
        <salary>60000</salary>
    </employee>
    <employee>
        <id>103</id>
        <name>Mike Johnson</name>
        <department>Finance</department>
        <salary>55000</salary>
    </employee>
</employees>
